Номер текста;Ключевые слова;Сведение;Title;URL;keywords;description;content 1;H1;H2;H3;анонс;strong
;займы наличными срочно;займы наличными быстро;;;;;;;;;;
;займы наличными быстро;займ без кредитной истории;;;;;;;;;;
;займ без кредитной истории;займы населению через интернет;;;;;;;;;;
;займы населению через интернет;быстрые займы без залога и поручителя;;;;;;;;;;
;быстрые займы без залога и поручителя;займы 50 000;;;;;;;;;;
;займы 50 000;дать займ под проценты;;;;;;;;;;
;дать займ под проценты;займ за 30 минут;;;;;;;;;;
;займ за 30 минут;займ денег по паспорту;;;;;;;;;;
;займ денег по паспорту;онлайн займы с плохой кредитной историей;;;;;;;;;;
;онлайн займы с плохой кредитной историей;кредитная история не важна займ;;;;;;;;;;
;кредитная история не важна займ;быстрый займ в питере;;;;;;;;;;
;быстрый займ в питере;;;;;;;;;;;
;;;;;;;;;;;;
;;;;;;;;;;;;
;;;;;;;;;;;;
3;кредитные брокеры;кредитные брокеры;;;;;;;;;;
;кредитные карты онлайн;кредитные карты онлайн;;;;;;;;;;
;оформить кредитную карту онлайн;оформить кредитную карту онлайн;;;;;;;;;;
;кредитные карты без справок о доходах;кредитные карты без справок о доходах;;;;;;;;;;
;кредитная карта онлайн заявка;кредитная карта онлайн заявка;;;;;;;;;;
;кредитные карты отп банка;кредитные карты отп банка;;;;;;;;;;
;кредитные карты без справок и поручителей;кредитные карты без справок и поручителей;;;;;;;;;;
;кредитная карта по почте;кредитная карта по почте;;;;;;;;;;
;кредитные карты в день обращения;кредитные карты в день обращения;;;;;;;;;;
;оформить кредитную карту;оформить кредитную карту;;;;;;;;;;
;оформляем кредитную карту;оформляем кредитную карту;;;;;;;;;;
;кредитная карта с льготным периодом;кредитная карта с льготным периодом;;;;;;;;;;
;как исправить кредитную историю;как исправить кредитную историю;;;;;;;;;;
;кредитные карты банков;кредитные карты банков;;;;;;;;;;
;кредитная карта банка;кредитная карта банка;;;;;;;;;;
;банк кредитных карт;банк кредитных карт;;;;;;;;;;
;микрозаймы с плохой кредитной историей;микрозаймы с плохой кредитной историей;;;;;;;;;;
;микрозайм с плохой кредитной историей;микрозайм с плохой кредитной историей;;;;;;;;;;
;оформить кредитную карту онлайн без справок;оформить кредитную карту онлайн без справок;;;;;;;;;;
;кредитные карты с 18 лет;кредитные карты с 18 лет;;;;;;;;;;
;моментальная кредитная карта;моментальная кредитная карта;;;;;;;;;;
;моментально кредитную карту;моментально кредитную карту;;;;;;;;;;
;быстрые кредитные карты;быстрые кредитные карты;;;;;;;;;;
;кредитные карты быстро;кредитные карты быстро;;;;;;;;;;
;плохая кредитная история;плохая кредитная история;;;;;;;;;;
;получить кредитную карту;получить кредитную карту;;;;;;;;;;
;кредитные карты с плохой кредитной историей;кредитные карты с плохой кредитной историей;;;;;;;;;;
;кредитные карты с плохой кредитной историей;кредитные карты с льготным периодом кредитования;;;;;;;;;;
;кредитные карты с льготным периодом кредитования;кредитная карта по паспорту;;;;;;;;;;
;кредитная карта по паспорту;кредитные карты с 20 лет;;;;;;;;;;
;кредитные карты с 20 лет;заявка на кредитные карты;;;;;;;;;;
;заявка на кредитные карты;кредитная карта заказать онлайн;;;;;;;;;;
;кредитная карта заказать онлайн;кредитная карта оформление онлайн;;;;;;;;;;
;кредитная карта оформление онлайн;кредитные карты без справок;;;;;;;;;;
;кредитные карты без справок;кредитная карта с льготным периодом на снятие наличных;;;;;;;;;;
;кредитная карта с льготным периодом на снятие наличных;кредитная карта на дом;;;;;;;;;;
;кредитная карта на дом;оформление кредитной карты;;;;;;;;;;
;оформление кредитной карты;кредитная карта с 19 лет;;;;;;;;;;
;кредитная карта с 19 лет;кредитные карты безработным;;;;;;;;;;
;кредитные карты безработным;кредитные карты с доставкой на дом;;;;;;;;;;
;кредитные карты с доставкой на дом;кредитная карта онлайн без справок;;;;;;;;;;
;кредитная карта онлайн без справок;получить кредитную карту по почте;;;;;;;;;;
;получить кредитную карту по почте;убрир кредитная карта;;;;;;;;;;
;убрир кредитная карта;заказать кредитную карту;;;;;;;;;;
;заказать кредитную карту;кредитные карты срочно;;;;;;;;;;
;кредитные карты срочно;срочные кредитные карты;;;;;;;;;;
;срочные кредитные карты;кредитная карта без справок в день обращения;;;;;;;;;;
;кредитная карта без справок в день обращения;кредитные карты с льготным периодом 100 дней;;;;;;;;;;
;кредитные карты с льготным периодом 100 дней;кредитная карта за 15 минут;;;;;;;;;;
;кредитная карта за 15 минут;лучшие кредитные карты;;;;;;;;;;
;лучшие кредитные карты;кредитные ставки;;;;;;;;;;
;кредитные ставки;заказать кредитную карту по почте;;;;;;;;;;
;заказать кредитную карту по почте;кредитная карта за 5 минут;;;;;;;;;;
;кредитная карта за 5 минут;кредитная карта за 1 день;;;;;;;;;;
;кредитная карта за 1 день;очищаю кредитную историю;;;;;;;;;;
;очищаю кредитную историю;очищу кредитную историю;;;;;;;;;;
;очищу кредитную историю;ипотека с плохой кредитной историей;;;;;;;;;;
;ипотека с плохой кредитной историей;кредитные карты студентам;;;;;;;;;;
;кредитные карты студентам;оформить кредитную карту через интернет;;;;;;;;;;
;оформить кредитную карту через интернет;плохая кредитная история что делать;;;;;;;;;;
;плохая кредитная история что делать;заказать кредитную карту через интернет;;;;;;;;;;
;заказать кредитную карту через интернет;подать заявку на кредитную карту;;;;;;;;;;
;подать заявку на кредитную карту;кредитная карта за час;;;;;;;;;;
;кредитная карта за час;кредитная карта через интернет;;;;;;;;;;
;кредитная карта через интернет;взять кредитную карту;;;;;;;;;;
;взять кредитную карту;кредитная карта с 21 года;;;;;;;;;;
;кредитная карта с 21 года;почистить кредитную историю;;;;;;;;;;
;почистить кредитную историю;кредитные карты пенсионером;;;;;;;;;;
;кредитные карты пенсионером;кредитная карта за один день;;;;;;;;;;
;кредитная карта за один день;кредитная карта по двум документам;;;;;;;;;;
;кредитная карта по двум документам;оформить заявку на кредитную карту;;;;;;;;;;
;оформить заявку на кредитную карту;кредитная карта условия;;;;;;;;;;
;кредитная карта условия;кредитная карта за 30 минут;;;;;;;;;;
;кредитная карта за 30 минут;получить кредитную карту в день обращения;;;;;;;;;;
;получить кредитную карту в день обращения;оформить онлайн кредитную карту без справок и поручителей;;;;;;;;;;
;оформить онлайн кредитную карту без справок и поручителей;помощь в получении кредитной карты;;;;;;;;;;
;помощь в получении кредитной карты;кредитные карты без посещения банка;;;;;;;;;;
;кредитные карты без посещения банка;выдача кредитов с плохой кредитной историей;;;;;;;;;;
;выдача кредитов с плохой кредитной историей;оформить кредитную карту с плохой кредитной историей;;;;;;;;;;
;оформить кредитную карту с плохой кредитной историей;оформить кредитную карту быстро;;;;;;;;;;
;оформить кредитную карту с плохой кредитной историей;кредитные заявки;;;;;;;;;;
;оформить кредитную карту быстро;перекредитование с плохой кредитной историей;;;;;;;;;;
;кредитные заявки;кредитные карты получение;;;;;;;;;;
;перекредитование с плохой кредитной историей;альфа кредитная карта;;;;;;;;;;
;кредитные карты получение;кредитные карты с льготным периодом 200 дней;;;;;;;;;;
;альфа кредитная карта;кредитные долги;;;;;;;;;;
;кредитные карты с льготным периодом 200 дней;помощь в получении ипотеки с плохой кредитной историей;;;;;;;;;;
;кредитные долги;получить кредитную карту с плохой кредитной историей;;;;;;;;;;
;помощь в получении ипотеки с плохой кредитной историей;кредитная карта без регистрации;;;;;;;;;;
;получить кредитную карту с плохой кредитной историей;кредитные карты по 2 документам;;;;;;;;;;
;получить кредитную карту с плохой кредитной историей;оформить кредитную карту без справок о доходах;;;;;;;;;;
;кредитная карта без регистрации;взять кредитную карту с плохой кредитной историей;;;;;;;;;;
;кредитные карты по 2 документам;как активировать кредитную карту;;;;;;;;;;
;оформить кредитную карту без справок о доходах;кредитная карта без прописки;;;;;;;;;;
;взять кредитную карту с плохой кредитной историей;быстрое оформление кредитной карты;;;;;;;;;;
;взять кредитную карту с плохой кредитной историей;кредитный дом;;;;;;;;;;
;как активировать кредитную карту;взять кредитную карту без справок и поручителей;;;;;;;;;;
;кредитная карта без прописки;взять кредитную карту онлайн;;;;;;;;;;
;быстрое оформление кредитной карты;сделать кредитную карту;;;;;;;;;;
;кредитный дом;дайте кредитную карту;;;;;;;;;;
;взять кредитную карту без справок и поручителей;помощь в получении автокредита с плохой кредитной историей;;;;;;;;;;
;взять кредитную карту онлайн;получить кредитную историю;;;;;;;;;;
;сделать кредитную карту;заказ кредитной карты онлайн;;;;;;;;;;
;дайте кредитную карту;оформление кредитной карты через интернет;;;;;;;;;;
;помощь в получении автокредита с плохой кредитной историей;взять кредитную карту быстро;;;;;;;;;;
;получить кредитную историю;онлайн заявка на кредитную карту без справок;;;;;;;;;;
;заказ кредитной карты онлайн;кредитная история физических лиц;;;;;;;;;;
;оформление кредитной карты через интернет;кредитная карта по одному документу;;;;;;;;;;
;взять кредитную карту быстро;кредитная карта за 1 час;;;;;;;;;;
;онлайн заявка на кредитную карту без справок;кредитная помощь;;;;;;;;;;
;кредитная история физических лиц;кредитная карта со льготным периодом;;;;;;;;;;
;кредитная карта по одному документу;кредитные карты оформить с 18 лет;;;;;;;;;;
;кредитная карта за 1 час;кредитная карта оформить без справок;;;;;;;;;;
;кредитная помощь;оформить онлайн заявку на кредитную карту;;;;;;;;;;
;кредитная карта со льготным периодом;ссуды с плохой кредитной историей;;;;;;;;;;
;кредитные карты оформить с 18 лет;запросить кредитную историю;;;;;;;;;;
;кредитная карта оформить без справок;кредитные карты по интернету;;;;;;;;;;
;оформить онлайн заявку на кредитную карту;кредитные карты с низким процентом;;;;;;;;;;
;ссуды с плохой кредитной историей;кредитная карта с доставкой по почте;;;;;;;;;;
;запросить кредитную историю;оформить кредитную карту на дом;;;;;;;;;;
;кредитные карты по интернету;оставить заявку на кредитную карту;;;;;;;;;;
;кредитные карты с низким процентом;хочу оформить кредитную карту;;;;;;;;;;
;кредитная карта с доставкой по почте;заказ кредитных карт;;;;;;;;;;
;оформить кредитную карту на дом;кредитные карты с моментальным решением;;;;;;;;;;
;оставить заявку на кредитную карту;кредитные карты без справок быстро;;;;;;;;;;
;хочу оформить кредитную карту;нужна кредитная карта;;;;;;;;;;
;заказ кредитных карт;расчет по кредитным картам;;;;;;;;;;
;кредитные карты с моментальным решением;оформление кредитной карты с 18 лет;;;;;;;;;;
;кредитные карты без справок быстро;кредитная карта с плохой кредитной;;;;;;;;;;
;нужна кредитная карта;помощь с плохой кредитной историей;;;;;;;;;;
;расчет по кредитным картам;получить кредитную карту по паспорту;;;;;;;;;;
;оформление кредитной карты с 18 лет;кредитование с плохой кредитной историей;;;;;;;;;;
;кредитная карта с плохой кредитной;кредитная карта моментального выпуска;;;;;;;;;;
;кредитная карта с плохой кредитной;оформить кредитную карту по паспорту;;;;;;;;;;
;помощь с плохой кредитной историей;как быстро получить кредитную карту;;;;;;;;;;
;получить кредитную карту по паспорту;срочно оформить кредитную карту;;;;;;;;;;
;кредитование с плохой кредитной историей;помощь кредитные карты;;;;;;;;;;
;кредитная карта моментального выпуска;кредитная карта по почте без справок;;;;;;;;;;
;оформить кредитную карту по паспорту;кредитные карты с 18 лет без справки о доходах;;;;;;;;;;
;как быстро получить кредитную карту;заявка на получение кредитной карты;;;;;;;;;;
;срочно оформить кредитную карту;кредитные карты с большим льготный период;;;;;;;;;;
;помощь кредитные карты;кредитная карта с временной регистрацией;;;;;;;;;;
;кредитная карта по почте без справок;кредитная история в банке;;;;;;;;;;
;кредитные карты с 18 лет без справки о доходах;кредитные карты по почте с плохой кредитной историей;;;;;;;;;;
;заявка на получение кредитной карты;кредитная карта с плохой историей;;;;;;;;;;
;кредитные карты с большим льготный период;кредитные онлайн;;;;;;;;;;
;кредитная карта с временной регистрацией;наличные с плохой кредитной историей;;;;;;;;;;
;кредитная история в банке;срочно нужна кредитная карта;;;;;;;;;;
;кредитные карты по почте с плохой кредитной историей;получить кредитную карту срочно;;;;;;;;;;
;кредитные карты по почте с плохой кредитной историей;кредитные карты онлайн в день обращения;;;;;;;;;;
;кредитная карта с плохой историей;что нужно для получения кредитной карты;;;;;;;;;;
;кредитные онлайн;помощь в оформлении кредитной карты;;;;;;;;;;
;наличные с плохой кредитной историей;кредитная карта с большим лимитом;;;;;;;;;;
;срочно нужна кредитная карта;уберем кредитную историю;;;;;;;;;;
;получить кредитную карту срочно;отправить заявку на кредитную карту;;;;;;;;;;
;кредитные карты онлайн в день обращения;кредитная карта объявление;;;;;;;;;;
;что нужно для получения кредитной карты;кредитная карта условия получения;;;;;;;;;;
;помощь в оформлении кредитной карты;кредитные карты с 18 лет без справок;;;;;;;;;;
;кредитная карта с большим лимитом;кредитная карта с нулевым лимитом;;;;;;;;;;
;уберем кредитную историю;заявка на кредитную карту по почте;;;;;;;;;;
;отправить заявку на кредитную карту;заявка на кредитную историю;;;;;;;;;;
;кредитная карта объявление;оформить кредитную карту для студентов;;;;;;;;;;
;кредитная карта условия получения;кредитные карточки по почте;;;;;;;;;;
;кредитные карты с 18 лет без справок;кредитные карты банка онлайн;;;;;;;;;;
;кредитная карта с нулевым лимитом;условия выдачи кредитной карты;;;;;;;;;;
;заявка на кредитную карту по почте;;;;;;;;;;;
;заявка на кредитную историю;;;;;;;;;;;
;оформить кредитную карту для студентов;;;;;;;;;;;
;кредитные карточки по почте;;;;;;;;;;;
;кредитные карты банка онлайн;;;;;;;;;;;
;условия выдачи кредитной карты;;;;;;;;;;;
;;;;;;;;;;;;
;;;;;;;;;;;;
;;;;;;;;;;;;
4;дам денег в долг;дам денег в долг;;;;;;;;;;
;дайте денег в долг;дайте денег в долг;;;;;;;;;;
;дай дeнег в долг;дай дeнег в долг;;;;;;;;;;
;дам денег в долг под расписку;дам денег в долг под расписку;;;;;;;;;;
;даю денег в долг под расписку;даю денег в долг под расписку;;;;;;;;;;
;дать денег в долг под расписку;дать денег в долг под расписку;;;;;;;;;;
;в долг ру;в долг ру;;;;;;;;;;
;взять в долг денег;взять в долг денег;;;;;;;;;;
;возьму денег в долг у частных лиц;возьму денег в долг у частных лиц;;;;;;;;;;
;дам денег в долг под проценты;дам денег в долг под проценты;;;;;;;;;;
;расписка в получении денег в долг;расписка в получении денег в долг;;;;;;;;;;
;дам в долг;дам в долг;;;;;;;;;;
;дайте в долг;дайте в долг;;;;;;;;;;
;даю в долг;даю в долг;;;;;;;;;;
;даем в долг;даем в долг;;;;;;;;;;
;дам в долг под расписку;дам в долг под расписку;;;;;;;;;;
;дают в долг под расписку;дают в долг под расписку;;;;;;;;;;
;даю в долг под расписку;даю в долг под расписку;;;;;;;;;;
;дам в долг денег частное лицо;дам в долг денег частное лицо;;;;;;;;;;
;частное лицо даст денег в долг;частное лицо даст денег в долг;;;;;;;;;;
;взыскание долга по расписке;взыскание долга по расписке;;;;;;;;;;
;взять денег в долг под расписку;взять денег в долг под расписку;;;;;;;;;;
;как выбить долги;как выбить долги;;;;;;;;;;
;в долг;в долг;;;;;;;;;;
