Номер текста;Ключевые слова;Сведение;Title;URL;keywords;description;content 1;H1;H2;H3;анонс;strong
1;деньги в долг срочно;деньги в долг срочно;;;;;;;;;;
;деньги в долг;деньги в долг;;;;;;;;;;
;деньги в долг под расписку;деньги в долг под расписку;;;;;;;;;;
;быстрые деньги;быстрые деньги;;;;;;;;;;
;срочно нужны деньги;срочно нужны деньги;;;;;;;;;;
;деньги онлайн;деньги онлайн;;;;;;;;;;
;помогите деньгами;помогите деньгами;;;;;;;;;;
;деньги до зарплаты;деньги до зарплаты;;;;;;;;;;
;срочно нужны деньги в долг;срочно нужны деньги в долг;;;;;;;;;;
;деньги на дом;деньги на дом;;;;;;;;;;
;онлайн игры на деньги;онлайн игры на деньги;;;;;;;;;;
;срочно деньги;срочно деньги;;;;;;;;;;
;срочные деньги;срочные деньги;;;;;;;;;;
;дам деньги в долг;дам деньги в долг;;;;;;;;;;
;даю деньги в долг;даю деньги в долг;;;;;;;;;;
;даем деньги в долг;даем деньги в долг;;;;;;;;;;
;дать деньги в долг;дать деньги в долг;;;;;;;;;;
;деньги под проценты;деньги под проценты;;;;;;;;;;
;деньги сразу;деньги сразу;;;;;;;;;;
;интим за деньги;интим за деньги;;;;;;;;;;
;деньги в долг под расписку от частного лица;деньги в долг под расписку от частного лица;;;;;;;;;;
;дам деньги;дам деньги;;;;;;;;;;
;даем деньги;даем деньги;;;;;;;;;;
;деньги дай;деньги дай;;;;;;;;;;
;деньги в долг даем деньги;деньги в долг даем деньги;;;;;;;;;;
;деньги за час;деньги за час;;;;;;;;;;
;отдамся за деньги;отдамся за деньги;;;;;;;;;;
;деньги сущность денег функции денег;деньги сущность денег функции денег;;;;;;;;;;
;срочно срочно нужны деньги;срочно срочно нужны деньги;;;;;;;;;;
;нужны деньги;нужны деньги;;;;;;;;;;
;мгновенные деньги;мгновенные деньги;;;;;;;;;;
;деньги мгновенно;деньги мгновенно;;;;;;;;;;
;деньги под расписку;деньги под расписку;;;;;;;;;;
;дам деньги в долг под расписку;дам деньги в долг под расписку;;;;;;;;;;
;даю деньги в долг под расписку;даю деньги в долг под расписку;;;;;;;;;;
;дают деньги в долг под расписку;дают деньги в долг под расписку;;;;;;;;;;
;дал деньги в долг под расписку;дал деньги в долг под расписку;;;;;;;;;;
;деньги частные займы частным лицам;деньги частные займы частным лицам;;;;;;;;;;
;минет за деньги;минет за деньги;;;;;;;;;;
;срочно нужны деньги плохая кредитная история;срочно нужны деньги плохая кредитная история;;;;;;;;;;
;взять деньги в долг;взять деньги в долг;;;;;;;;;;
;деньги в долг срочно с плохой кредитной историей;деньги в долг срочно с плохой кредитной историей;;;;;;;;;;
;деньги в займы;деньги в займы;;;;;;;;;;
;взять деньги в долг у частного лица;взять деньги в долг у частного лица;;;;;;;;;;
;занять деньги;занять деньги;;;;;;;;;;
;интернет деньги;интернет деньги;;;;;;;;;;
;дам деньги в долг под проценты;дам деньги в долг под проценты;;;;;;;;;;
;даю деньги в долг под проценты;даю деньги в долг под проценты;;;;;;;;;;
;даем деньги в долг под проценты;даем деньги в долг под проценты;;;;;;;;;;
;дайте деньги в долг под проценты;дайте деньги в долг под проценты;;;;;;;;;;
;срочно нужны деньги в долг под расписку;срочно нужны деньги в долг под расписку;;;;;;;;;;
;быстрые деньги в долг;быстрые деньги в долг;;;;;;;;;;
;быстро деньги в долг;быстро деньги в долг;;;;;;;;;;
;деньги дома;деньги дома;;;;;;;;;;
;вложить деньги под проценты;вложить деньги под проценты;;;;;;;;;;
;деньги под проценты у частного лица;деньги под проценты у частного лица;;;;;;;;;;
;деньги наличными;деньги наличными;;;;;;;;;;
;дам деньги в долг частное лицо;дам деньги в долг частное лицо;;;;;;;;;;
;частное лицо даст деньги в долг;частное лицо даст деньги в долг;;;;;;;;;;
;чaстноe лицо дам деньги в долг;чaстноe лицо дам деньги в долг;;;;;;;;;;
;деньги в рассрочку;деньги в рассрочку;;;;;;;;;;
;быстрые деньги займ;быстрые деньги займ;;;;;;;;;;
;деньги взаймы;деньги взаймы;;;;;;;;;;
;срочный займ займу деньги;срочный займ займу деньги;;;;;;;;;;
;деньги в долг с плохой кредитной историей;деньги в долг с плохой кредитной историей;;;;;;;;;;
;деньги срочно с плохой кредитной историей;деньги срочно с плохой кредитной историей;;;;;;;;;;
;дам деньги под проценты;дам деньги под проценты;;;;;;;;;;
;даю деньги под проценты;даю деньги под проценты;;;;;;;;;;
;дать деньги под проценты;дать деньги под проценты;;;;;;;;;;
;займу деньги под расписку;займу деньги под расписку;;;;;;;;;;
;займу деньги под проценты;займу деньги под проценты;;;;;;;;;;
;вложу деньги в бизнес;вложу деньги в бизнес;;;;;;;;;;
;деньги в займы срочно;деньги в займы срочно;;;;;;;;;;
;возьму деньги под проценты;возьму деньги под проценты;;;;;;;;;;
;дам деньги под расписку;дам деньги под расписку;;;;;;;;;;
;даю деньги под расписку;даю деньги под расписку;;;;;;;;;;
;даем деньги под расписку;даем деньги под расписку;;;;;;;;;;
;взять деньги в долг под расписку;взять деньги в долг под расписку;;;;;;;;;;
;деньги ру;деньги ру;;;;;;;;;;
;деньги в долг теле2;деньги в долг теле2;;;;;;;;;;
;деньги в долг без банка;деньги в долг без банка;;;;;;;;;;
;деньги в долг без банков;деньги в долг без банков;;;;;;;;;;
;деньги под честное слово;деньги под честное слово;;;;;;;;;;
;деньги день в день;деньги день в день;;;;;;;;;;
;возьму деньги в долг под проценты у частного лица;возьму деньги в долг под проценты у частного лица;;;;;;;;;;
;деньги в банк под проценты;деньги в банк под проценты;;;;;;;;;;
;занять деньги срочно;занять деньги срочно;;;;;;;;;;
;деньги до зарплаты онлайн;деньги до зарплаты онлайн;;;;;;;;;;
;взять деньги в долг срочно;взять деньги в долг срочно;;;;;;;;;;
;срочный взять деньги в долг;срочный взять деньги в долг;;;;;;;;;;
;любовь за деньги;любовь за деньги;;;;;;;;;;
;деньги в долг под проценты;деньги в долг под проценты;;;;;;;;;;
;деньги взаймы срочно;деньги взаймы срочно;;;;;;;;;;
;деньги всем;деньги всем;;;;;;;;;;
;деньги в день обращения;деньги в день обращения;;;;;;;;;;
;занять деньги в долг;занять деньги в долг;;;;;;;;;;
;деньги под расписку срочно;деньги под расписку срочно;;;;;;;;;;
;одолжу деньги;одолжу деньги;;;;;;;;;;
;срочно нужны деньги помогите;срочно нужны деньги помогите;;;;;;;;;;
;деньги срочный займ;деньги срочный займ;;;;;;;;;;
;доступные деньги;доступные деньги;;;;;;;;;;
;занять деньги у частного лица;занять деньги у частного лица;;;;;;;;;;
;моментальные деньги;моментальные деньги;;;;;;;;;;
;срочные деньги в долг от частного лица;срочные деньги в долг от частного лица;;;;;;;;;;
;соцопросы за деньги;соцопросы за деньги;;;;;;;;;;
;займу деньги ру;займу деньги ру;;;;;;;;;;
;деньги в долг по паспорту;деньги в долг по паспорту;;;;;;;;;;
;помощь деньгами;помощь деньгами;;;;;;;;;;
;онлайн деньги в долг;онлайн деньги в долг;;;;;;;;;;
;дам деньги в долг срочно;дам деньги в долг срочно;;;;;;;;;;
;даю деньги в долг срочно;даю деньги в долг срочно;;;;;;;;;;
;возьму деньги под проценты у частного лица;возьму деньги под проценты у частного лица;;;;;;;;;;
;срочно деньги под проценты;срочно деньги под проценты;;;;;;;;;;
;срочно взять срочно деньги в долг;срочно взять срочно деньги в долг;;;;;;;;;;
;деньги получить;деньги получить;;;;;;;;;;
;деньги наличными в день обращения;деньги наличными в день обращения;;;;;;;;;;
;взять деньги;взять деньги;;;;;;;;;;
;деньги на бизнеса;деньги на бизнеса;;;;;;;;;;
;очень срочно нужны деньги;очень срочно нужны деньги;;;;;;;;;;
;срочно нужны деньги в долг с плохой кредитной историей;срочно нужны деньги в долг с плохой кредитной историей;;;;;;;;;;
;возьму деньги в долг под проценты;возьму деньги в долг под проценты;;;;;;;;;;
;деньги за 15 минут;деньги за 15 минут;;;;;;;;;;
;деньги в долг срочно под расписку;деньги в долг срочно под расписку;;;;;;;;;;
;деньги в долг в нсс;деньги в долг в нсс;;;;;;;;;;
;быстрые деньги онлайн;быстрые деньги онлайн;;;;;;;;;;
;как вернуть деньги по расписке;как вернуть деньги по расписке;;;;;;;;;;
;очень нужны деньги;очень нужны деньги;;;;;;;;;;
;нужны деньги в долг;нужны деньги в долг;;;;;;;;;;
;микро деньги;микро деньги;;;;;;;;;;
;деньги на дом срочно;деньги на дом срочно;;;;;;;;;;
;дам деньги на бизнес;дам деньги на бизнес;;;;;;;;;;
;банк быстро деньги;банк быстро деньги;;;;;;;;;;
;деньги до зарплаты франшиза;деньги до зарплаты франшиза;;;;;;;;;;
;частные деньги;частные деньги;;;;;;;;;;
;деньги по паспорту;деньги по паспорту;;;;;;;;;;
;взять деньги в долг с плохой кредитной историей;взять деньги в долг с плохой кредитной историей;;;;;;;;;;
;деньги в долг срочно с 18 лет;деньги в долг срочно с 18 лет;;;;;;;;;;
;деньги с плохой кредитной историей;деньги с плохой кредитной историей;;;;;;;;;;
;срочные деньги в долг с 18 лет;срочные деньги в долг с 18 лет;;;;;;;;;;
;деньги в долг безработным;деньги в долг безработным;;;;;;;;;;
;куни за деньги;куни за деньги;;;;;;;;;;
;микрофинанс деньги сразу;микрофинанс деньги сразу;;;;;;;;;;
;деньги без справок и поручителей;деньги без справок и поручителей;;;;;;;;;;
;даю деньги в долг без залога;даю деньги в долг без залога;;;;;;;;;;
;дам деньги в долг без залога;дам деньги в долг без залога;;;;;;;;;;
;одолжу деньги под проценты;одолжу деньги под проценты;;;;;;;;;;
;взять деньги под расписку;взять деньги под расписку;;;;;;;;;;
;деньги в долг до зарплаты;деньги в долг до зарплаты;;;;;;;;;;
;даем деньги ру;даем деньги ру;;;;;;;;;;
;дам деньги ру;дам деньги ру;;;;;;;;;;
;нано деньги;нано деньги;;;;;;;;;;
;деньги частный займ;деньги частный займ;;;;;;;;;;
;деньги в долг под расписку без залога;деньги в долг под расписку без залога;;;;;;;;;;
;нужны деньги под проценты;нужны деньги под проценты;;;;;;;;;;
;деньги без проблем;деньги без проблем;;;;;;;;;;
;взять деньги быстро;взять деньги быстро;;;;;;;;;;
;взять быстрые деньги;взять быстрые деньги;;;;;;;;;;
;мгновенные деньги онлайн заявка;мгновенные деньги онлайн заявка;;;;;;;;;;
;центрозайм деньги до зарплаты;центрозайм деньги до зарплаты;;;;;;;;;;
;быстрые деньги до зарплаты;быстрые деньги до зарплаты;;;;;;;;;;
;деньги до получки;деньги до получки;;;;;;;;;;
;деньги до зарплаты быстро;деньги до зарплаты быстро;;;;;;;;;;
;срочно нужны деньги под проценты;срочно нужны деньги под проценты;;;;;;;;;;
;пересплю за деньги;пересплю за деньги;;;;;;;;;;
;деньги взаймы под проценты;деньги взаймы под проценты;;;;;;;;;;
;срочно взять деньги;срочно взять деньги;;;;;;;;;;
;деньги в долг срочно у частного лица;деньги в долг срочно у частного лица;;;;;;;;;;
;взять деньги в рассрочку;взять деньги в рассрочку;;;;;;;;;;
;обои для рабочего стола деньги рубли;обои для рабочего стола деньги рубли;;;;;;;;;;
;деньги в долг объявления;деньги в долг объявления;;;;;;;;;;
;деньги на малого бизнеса;деньги на малого бизнеса;;;;;;;;;;
;деньги в долг без процентов;деньги в долг без процентов;;;;;;;;;;
;деньги в кармане;деньги в кармане;;;;;;;;;;
;деньги в долг деньги до зарплаты;деньги в долг деньги до зарплаты;;;;;;;;;;
;деньги в долг без залога;деньги в долг без залога;;;;;;;;;;
;деньги без залога и поручителей;деньги без залога и поручителей;;;;;;;;;;
;получит деньги быстро;получит деньги быстро;;;;;;;;;;
;быстрые деньги получить;быстрые деньги получить;;;;;;;;;;
;деньги без банка;деньги без банка;;;;;;;;;;
;деньги людям;деньги людям;;;;;;;;;;
;занять деньги до зарплаты;занять деньги до зарплаты;;;;;;;;;;
;нужны деньги с плохой кредитной историей;нужны деньги с плохой кредитной историей;;;;;;;;;;
;кто дает деньги под проценты;кто дает деньги под проценты;;;;;;;;;;
;дам деньги под проценты срочно;дам деньги под проценты срочно;;;;;;;;;;
;дам деньги в долг срочно деньги;дам деньги в долг срочно деньги;;;;;;;;;;
;ищу деньги в долг;ищу деньги в долг;;;;;;;;;;
;деньги с 18 лет;деньги с 18 лет;;;;;;;;;;
;занять деньги быстро;занять деньги быстро;;;;;;;;;;
;дайте деньги срочно под проценты;дайте деньги срочно под проценты;;;;;;;;;;
;дам деньги под проценты у частного лица;дам деньги под проценты у частного лица;;;;;;;;;;
;нужна помощь деньгами;нужна помощь деньгами;;;;;;;;;;
;деньги в долг в гродно;деньги в долг в гродно;;;;;;;;;;
;даю деньги под проценты у частных лиц;даю деньги под проценты у частных лиц;;;;;;;;;;
;дам в рот за деньги;дам в рот за деньги;;;;;;;;;;
;деньги студентам;деньги студентам;;;;;;;;;;
;если срочно нужны деньги что делать;если срочно нужны деньги что делать;;;;;;;;;;
;объявления о деньгах;объявления о деньгах;;;;;;;;;;
;взять деньги до зарплаты;взять деньги до зарплаты;;;;;;;;;;
;дам деньги в займы;дам деньги в займы;;;;;;;;;;
;даем в займы деньги;даем в займы деньги;;;;;;;;;;
;даю деньги в займы;даю деньги в займы;;;;;;;;;;
;деньги под проценты без залога;деньги под проценты без залога;;;;;;;;;;
;срочно нужны деньги до зарплаты;срочно нужны деньги до зарплаты;;;;;;;;;;
;деньги под проценты под расписку;деньги под проценты под расписку;;;;;;;;;;
;получить деньги в долг;получить деньги в долг;;;;;;;;;;
;бизнес деньги в долг;бизнес деньги в долг;;;;;;;;;;
;дом под деньги под;дом под деньги под;;;;;;;;;;
;деньги под паспорт;деньги под паспорт;;;;;;;;;;
;срочно деньги безработным;срочно деньги безработным;;;;;;;;;;
;как получить деньги с должника;как получить деньги с должника;;;;;;;;;;
;возьму деньги взаймы;возьму деньги взаймы;;;;;;;;;;
;нужны деньги помогите;нужны деньги помогите;;;;;;;;;;
;деньги в залог;деньги в залог;;;;;;;;;;
;деньги в долг без справок и поручителей;деньги в долг без справок и поручителей;;;;;;;;;;
;деньги без справок;деньги без справок;;;;;;;;;;
;деньги в долг без справок без поручителей;деньги в долг без справок без поручителей;;;;;;;;;;
;взять деньги у частного лица;взять деньги у частного лица;;;;;;;;;;
;деловые деньги;деловые деньги;;;;;;;;;;
;дам деньги под проценты без залога;дам деньги под проценты без залога;;;;;;;;;;
;деньги срочно до зарплаты;деньги срочно до зарплаты;;;;;;;;;;
;взять деньги в займы;взять деньги в займы;;;;;;;;;;
;срочно надо деньги;срочно надо деньги;;;;;;;;;;
;активные деньги;активные деньги;;;;;;;;;;
;деньги в долг круглосуточно;деньги в долг круглосуточно;;;;;;;;;;
;деньги в долг на дом;деньги в долг на дом;;;;;;;;;;
;деньги в долг qiwi;деньги в долг qiwi;;;;;;;;;;
;срочно нужны деньги от частного лица;срочно нужны деньги от частного лица;;;;;;;;;;
;деньги в долг студентам;деньги в долг студентам;;;;;;;;;;
;деньги до зп;деньги до зп;;;;;;;;;;
;деньги за 30 минут;деньги за 30 минут;;;;;;;;;;
;возьму деньги в долг у частного лица под расписку;возьму деньги в долг у частного лица под расписку;;;;;;;;;;
;нуждаюсь в деньгах;нуждаюсь в деньгах;;;;;;;;;;
;деньги наличными срочно;деньги наличными срочно;;;;;;;;;;
;деньги под зарплату;деньги под зарплату;;;;;;;;;;
;дам деньги взаймы;дам деньги взаймы;;;;;;;;;;
;дам деньги в долг объявления;дам деньги в долг объявления;;;;;;;;;;
;срочно дам деньги в долг под расписку;срочно дам деньги в долг под расписку;;;;;;;;;;
;объявление даю деньги в долг;объявление даю деньги в долг;;;;;;;;;;
;дают деньги взаймы;дают деньги взаймы;;;;;;;;;;
;займу деньги без залога;займу деньги без залога;;;;;;;;;;
;помощь в получение деньги;помощь в получение деньги;;;;;;;;;;
;деньги в долг не банк;деньги в долг не банк;;;;;;;;;;
;деньги в долг срочно под проценты;деньги в долг срочно под проценты;;;;;;;;;;
;деньги 1;деньги 1;;;;;;;;;;
;деньги ссуду;деньги ссуду;;;;;;;;;;
;взять деньги под проценты срочно;взять деньги под проценты срочно;;;;;;;;;;
;взять деньги в долг срочно у частного лица;взять деньги в долг срочно у частного лица;;;;;;;;;;
;деньги под бизнес;деньги под бизнес;;;;;;;;;;
;встречусь за деньги;встречусь за деньги;;;;;;;;;;
;частные объявления деньги в долг;частные объявления деньги в долг;;;;;;;;;;
;деньги в долг с 20 лет;деньги в долг с 20 лет;;;;;;;;;;
;деньги под;деньги под;;;;;;;;;;
;окажу помощь деньгами;окажу помощь деньгами;;;;;;;;;;
;дам деньги всем;дам деньги всем;;;;;;;;;;
;деньги в долг в залог паспорт;деньги в долг в залог паспорт;;;;;;;;;;
;даем деньги всем;даем деньги всем;;;;;;;;;;
